{
  "$schema": "./schema/data.schema.json",
  "metadata": {
    "title": "Егор Гаврилов — Java Backend Developer",
    "description": "Java Backend-разработчик. Работаю с Java 17/21/25, Spring Boot 3.x/4.x.",
    "author": "Егор Гаврилов",
    "url": "https://oldzoomer.ru",
    "language": "ru",
    "updatedAt": "2026-03-31T05:30:00Z"
  },
  "person": {
    "name": "Егор Гаврилов",
    "jobTitle": "Java Backend Developer",
    "email": "work@oldzoomer.ru",
    "description": "Java Backend-разработчик, сертифицированный Vaadin и Cloud.ru специалист.",
    "sameAs": [
      "https://t.me/oldzoomer_ru",
      "https://github.com/oldzoomer-ru"
    ],
    "knowsAbout": [
      "Java 21",
      "Spring Boot",
      "Kafka",
      "PostgreSQL",
      "Docker",
      "FidoNet"
    ]
  },
  "content": {
    "mainPageFileUrl": "https://raw.githubusercontent.com/oldzoomer-ru/oldzoomer-ru/refs/heads/master/README.md"
  },
  "cv": {
    "personal": {
      "name": "Гаврилов Егор Денисович",
      "email": "work@oldzoomer.ru",
      "telegram": "@oldzoomer_ru",
      "setka": "https://set.ki/Dzarbxm",
      "github": "https://github.com/oldzoomer-ru",
      "website": "https://oldzoomer.ru",
      "location": "Кстово",
      "citizenship": "RU"
    },
    "desiredPosition": {
      "title": "Java-разработчик (Spring)",
      "specializations": ["Программист, разработчик"],
      "employmentType": ["полная занятость", "стажировка"],
      "workFormat": ["на месте работодателя", "удалённо", "гибрид"]
    },
    "summary": "- Backend-разработчик, специализируюсь на стеке Java / Spring.\n- Навыки DevOps: развертывание и поддержка приложений, автоматизация инфраструктуры.\n- Общий опыт в ИИ: MLOps, локальные ИИ-модели, работа с ИИ-агентами (Continue, Roo Code, VeAl).\n\nРассматриваю удалёнку по всей РФ (в т. ч. и в других часовых поясах), гибрид в Нижнем Новгороде, и гибрид/офис в Кстово.",
    "experience": [
      {
        "position": "Java-разработчик",
        "company": "AISA",
        "location": "Санкт-Петербург",
        "startDate": "2024-04-01",
        "endDate": "2024-08-31",
        "description": [
          "Перевел систему планирования бюджета региона с Microsoft Access на современный стек (Spring, Vaadin), что сняло зависимость от Windows и упростило дальнейшую поддержку.",
          "Разработал UI-компонентов на Vaadin для точного воспроизведения интерфейса старой системы, обеспечив бесшовный и привычный пользовательский опыт для сотрудников."
        ]
      }
    ],
    "education": [
      {
        "institution": "Международный Восточно-Европейский колледж",
        "location": "Ижевск",
        "degree": "Среднее специальное",
        "field": "Информационные системы и программирование",
        "graduationYearStart": 2021,
        "graduationYearEnd": 2026
      }
    ],
    "projects": [
      {
        "name": "StingrayTV Alice",
        "description": "IoT-шлюз для управления ресивером Триколора через Алису\n\nЦель проекта - интеграция ресиверов Триколора с сервисом \"Дом с Алисой\" от Яндекс.\n\nПлатформа StingrayTV, используемая в ресиверах General Satellite (которые, в свою очередь, и используются Триколором), имеет внешний REST API, который используются в первую очередь мобильными приложениями Триколора (такими как \"Второй экран\").\n\nОднако, я смог приспособить API для куда более интересного использования - а именно для интеграции ресивера со stateless middleware, который и позволяет управлять ресивером через Алису.",
        "codeRepository": "https://github.com/oldzoomer-ru/stingraytv-alice",
        "programmingLanguage": "Java",
        "startDate": "2025-11",
        "endDate": "2026-01"
      },
      {
        "name": "NodehistJ",
        "description": "Система для работы с историей любительской компьютерной сети FidoNet (а именно - с историей появления/исчезновения узлов сети в нодлистах - сервис обрабатывает нодлисти с 1984 года, и по сей день).\n\nСервис использует Spring Data JDBC для быстрой потоковой обработки данных, PostgreSQL для хранения индексов, и другие современные технологии.\n\nБлагодаря переходу с JPA на JDBC-стек, мне удалось снизить время индексации нодлистов и их диффов с нескольких дней до 30 минут, на слабом сервере с 2x10% vCPU и 4 Гб ОЗУ.",
        "codeRepository": "https://github.com/oldzoomer-ru/nodehistj",
        "programmingLanguage": "Java",
        "startDate": "2025-04",
        "endDate": "2026-01"
      }
    ],
    "languages": [
      {
        "language": "ru",
        "level": "native"
      },
      {
        "language": "en",
        "level": "b1"
      }
    ],
    "skills": {
      "technical": [
        "Java",
        "Spring Framework",
        "Docker",
        "Gradle",
        "Apache Kafka",
        "SQL",
        "Apache Maven",
        "Mockito",
        "API",
        "JUnit",
        "Flyway",
        "Hibernate",
        "Redis",
        "Keycloak",
        "OIDC",
        "Linux",
        "PostgreSQL",
        "Git",
        "Spring Boot",
        "REST API",
        "Spring Data",
        "Spring MVC",
        "Spring Security",
        "Atlassian Jira",
        "Atlassian Confluence",
        "Swagger"
      ]
    }
  }
}